{
  "schema": "vertical_pack.v1",
  "pack": {
    "id": "devdocs",
    "name": "Developer Docs",
    "tab_label": "Docs"
  },
  "ranking": {
    "title_weight": 2.5,
    "body_weight": 1.0,
    "code_weight": 0.8,
    "anchor_weight": 1.5,
    "recency_half_life_days": 0,
    "bm25_k1": 1.2,
    "bm25_b": 0.75
  },
  "limits": {
    "max_pages": 500,
    "max_depth": 8,
    "max_body_bytes": 5242880
  },
  "politeness": {
    "default_rps_per_host": 1.0,
    "respect_robots": true,
    "respect_crawl_delay": true
  },
  "hosts": {
    "allowed": ["localhost", "fixture-site"]
  },
  "url_filters": {
    "deny_contains": ["/search?", "/login", "?page=", "#"]
  },
  "content": {
    "main_selectors": ["main", "article", "#content"],
    "title_selectors": ["h1", "title"]
  },
  "code": {
    "preserve_selectors": ["pre", "code"]
  },
  "seeds": ["http://localhost:7799/index.html"]
}
